{
  "$schema": "https://json-schema.org/draft/2020-12/schema",
  "$id": "https://jevkit.invalid/schema/plugin-claude-marketplace-v1.json",
  "title": "Claude Code marketplace.json",
  "type": "object",
  "additionalProperties": false,
  "required": ["name", "description", "owner", "plugins"],
  "properties": {
    "name": { "type": "string", "const": "jevkit-plugins" },
    "description": { "type": "string", "minLength": 1 },
    "owner": {
      "type": "object",
      "additionalProperties": false,
      "required": ["name"],
      "properties": {
        "name": { "type": "string", "minLength": 1 }
      }
    },
    "plugins": {
      "type": "array",
      "minItems": 1,
      "items": {
        "type": "object",
        "additionalProperties": false,
        "required": ["name", "source", "description", "version"],
        "properties": {
          "name": { "type": "string", "const": "jevkit" },
          "source": { "type": "string", "minLength": 1 },
          "description": { "type": "string", "minLength": 1 },
          "version": { "type": "string", "minLength": 1 }
        }
      }
    }
  }
}
